text,target,title,date,check
" you may have been able to bounce the front up but not actually do a ""wheelie"". see the shaft effect unloads the rear susspension and effectivly loads the front. this is why a shaft bike should accelerate if it starts scraping in a corner...... ",8,rec.motorcycles,2023-10-14 18:59:16.722480,yes
" Oh yeah, all the time.  On a nice spring/summer day, I roll down the window and drive around looking for bikes.  When a bike motors by in the opposite direction, I stick my arm out and hi5'em.  My arm feels like a million  bucks when I'm doing this a 60km/h.  I do the same thing with cyclists. The only problem with hi5ing a cyclist is their always in the right hand lane. I hafta roll down the other window and hi5 them on the back.  Oh well, I  think they appreciate the thought.   Regards, Ted. ",8,rec.motorcycles,2023-10-14 18:59:16.722480,yes
"  Yeah!  I found beelzebub inside a worm...yeah, that's it!  (actually it was vodka - Gordon's if I remember correctly... I didn't even buy it (of course, that's probably the reason I drank _so_ much of it that night...never again.)  ",8,rec.motorcycles,2023-10-14 18:59:16.722480,yes
"I looked at that Bimmer yesterday. It's an '81, has about 90kmi, according to owner (odometer stopped working at 68Kmi). Drivess well, sounds good, body is OK, he wants $3000. i liked the car, despite it's auto tranny, but my wife will be a primary driver on this one, and she wants auto. The radio does not work untill the car warms up and you honk the horn (!) The A/C seems to have a leak.  The sunroof is sticky, but operational. Odometer does not work, as mentioned before. Idle is a bit bouncy, going from 900rpm to 1200rpm. Wipers are slow. That's teh gripes. The owner says that he changed radiator, alternator,  rotors and calipers, exhaust. The biggest problem, is that the owner is a shifty SOB, telling strange stories. I hate that. I would never buy from a persom like that, except, how often you see a descent 528i for that amount of money. He also said that, although I could bring a mechanicin, he wouldn't let me check the car by taking  it to a garage. Suspicious. And who knows what milage is on it. So, let me know what to check for, given",7,rec.autos,2023-10-14 18:59:16.722480,yes
Does anyone know the status of Jeffries or Arocha? ,9,rec.sport.baseball,2023-10-14 18:59:16.722480,yes
"Oh, yea, and Chris Bosio pitched a NO-HITTER.  One over the minimum, two bases on ball in the first inning, one runner left, 95 pitches.  I listened to the game on radio and listening to Dave Niehaus call the game was a real treat (as long as they keep Ron Fairly quite, I doubt if anyone is better than Niehaus -- but that Fairly guy is really annoying me).  But, I guess if Clemens or Viola had been pitching, it would have  been a different story :-)  Two shutouts in two nights against the hottest, best hitting team in Major League baseball ....  Pretty impressive in any league.  Man, if Johnson, Bosio and Hanson keep going the Mariners could be a  really interesting team to follow this year.  Also, John Cummings (rookie) has had three solid outings with no support.  If Fleming comes back  this may be the best starting staff in the American League this year (relief is another story, though - grimace).  Too cool.  The first no-hitter that I have been able to follow from  start to end.  And again, I think Niehaus",9,rec.sport.baseball,2023-10-14 18:59:16.722480,yes
Yeah... and BMW 525e has 2.7 litres   535      3.4   BTW - can someone out there please tell me how to put someone else's file  on and then reply to that so the other person's file and my own 'reply' go to the newgroups together? (ps: just mail me personally) ,7,rec.autos,2023-10-14 18:59:16.722480,yes
" The problem is that (by no fault of ESPN) ongoing games are not covered 'til the final horn sounds.  With two channels, SCNY and SCA, late-finishing games (up to Pacific time) and overtimes elsewhere will kick in at the end of local coverage.  If SCNY is blocked by the Mets, there is still some hockey on SCA (SCNY Plus).  With an ESPN 2, the current situation would be alleviated.  gld",10,rec.sport.hockey,2023-10-14 18:59:16.722480,yes
" Minor point:  Shea Stadium was designed as a multi-purpose stadium but not with the Jets in mind as the tennant.  The New York Football Giants had moved to Yankee Stadium (from the Polo Grounds) in 1958 and was having problem with stadium management (the City did not own Yankee Stadium until 1972).  The idea was to get the Giants to move into Shea. When a deal was worked out between the Giants and the Yankees the new AFL franchise, the New York Titans, approached the City about using the new stadium.  The Titans were playing in Downing Stadium (where the Cosmos played soccer in the 70s).  Because Shea Stadium was tied into the World's Fair anyway, the city thought it would be a novel idea to promote the new franchise and the World's Fair (like they were doing with the Mets).  So the deal was worked out.   I'm under the impression that when Murph says it, he means it!  As a regular goer to Shea, it is not a bad place since they've cleaned and renovated the place.  Remember, this is its 30th Year!",9,rec.sport.baseball,2023-10-14 18:59:16.722480,yes
"} Last night, Boston Red Sox win its 11 games of 14 games by beating Seattle } 5-2.  Roger Clemson pitch not so dominate.  He walked at least 6 man in } first 6 inns.  But Valetin and Greenwell hit homeruns and Red Sox prevail.  Clemens struggled with his control, but was also the ""beneficiary"" of some pretty shoddy umpiring. but to be fair, most of the walks were early in the game, and he adjusted. he was also helped by (dare i say it?) some pretty good defense by the Sox, including Rivera playing at second, not his normal position.  actually, Clemens is pretty lucky that he got the win, considering the Sox almost gave up the lead in the bottom of the 7th on Mo's error catching a throw-over.  } I think that game is must win for Red Sox in Seattle, considering Darwin will } faced Seattle ace Randy Johnson tonight.  must win? in April? they've already won 4 more games so far than anyone thought they would at this  point of the season... i hope people aren't getting too caught up in this streak; it's been fun, but",9,rec.sport.baseball,2023-10-14 18:59:16.722480,yes
"I do. Yesterday.  Seriously, Countess Ada of Lovelace gets the credit.  She first used it in the late 80s.  Her bike:  the spokeless wonder.   Jack Waters II DoD#1919",8,rec.motorcycles,2023-10-14 18:59:16.722480,yes
"           Jim,  I hope you never drive (or ride) when:  you have been drinking  you have been taking prescription drugs you didn't get enough sleep the night before you are upset with your girlfriend you just didn't feel like your brain was talking to your body you think you are at laguna seca and want to break the lap record  ANY of the above situations have the potential for harm (read death) People make mistakesIf you have never endangered someone else by driving a vehicle in an unsafe manner, then go right ahead and bitch about Mr Infante misuse of a motor vehicle.  Otherwise, think about your OWN driving responsibilities.  I am sorry about the loss of your friends, but it could just as well been the idiot who bought a Volvo because he has problems falling asleep at the wheel.  Eric",8,rec.motorcycles,2023-10-14 18:59:16.722480,yes
"""Silver Dream Racer"" -- Frustrated Brit club racer's buddy dies, leaving him a built-in-garage ""revolutionary, experimental"" 500 GP bike. Brit club racer uses machine to beat Bad American on Bad Japanese Factory Bike at British GP.  Filmed at Silverstone, I believe.  Pretty bad.  -----------------------------------------------------------------------------",8,rec.motorcycles,2023-10-14 18:59:16.722480,yes
<come along since the Mazda MPV.  The NISSAN MAXIMA engine paired with <the rest of the vehicle seems well engineered.  Only the price is,7,rec.autos,2023-10-14 18:59:16.722480,yes
" As long as a player is under contract to an organization, he is obligated to play only where that organization tells him to play or gives him permission to play. The Rangers are certainly within their rights to force Zubov and Andersson to report to Binghampton.   It certainly does reflect a lack of class on the part of the Ranger  organization, however. Is having Binghampton win the Calder Cup really more important to them than keeping their players happy? ",10,rec.sport.hockey,2023-10-14 18:59:16.722480,yes
"      I suspect that splits such as these are the result of positioning.  An outfielder who is fast and gets a good jump would be expected to catch a lot of balls, preventing both singles and doubles, and also cut off more uncatchable balls, turinging doubles into singles.  However, a fielder who plays shallow will catch more short flies and fewer long flies; this means that he will allow fewer singles but more doubles.  Has anyone seen these players' positioning?  Do Butler and Felix play deep, and Lankford, Martinez, and Wilson shallow, or is this a park effect?  I thought Butler liked to play shallow. ",9,rec.sport.baseball,2023-10-14 18:59:16.722480,yes
"According to an article in the LA Times, Todd Worrell will not be ready to come off the DL list Friday.  It sounds like he has had another set back in his come back.  At present, he has stopped throwing the ball.  Supposedly, he had no velocity.  It doesn't sound like there is any particular time table at this point for when he will be back.",9,rec.sport.baseball,2023-10-14 18:59:16.722480,yes
Sabres are Fuhr or know much   Two words: Grant Fuhr.,10,rec.sport.hockey,2023-10-14 18:59:16.722480,yes
from Matthew Rush:  It's pretty obvious that Holik's hitting Barrasso was an accident. He was even apologizing for it immediately before the Penguins all jumped on him.,10,rec.sport.hockey,2023-10-14 18:59:16.722480,yes
"I, too, put a corbin seat on my Hawk.  I got the solo seat (which could carry a passenger for a short distance) and it is 100% better than the stock seat.  No longer does my voice squeak after the ride to work.",8,rec.motorcycles,2023-10-14 18:59:16.722480,yes
They could put on a Quebec-Montreal game.  Talk a bout areivalry! opps rivalry..  roland,10,rec.sport.hockey,2023-10-14 18:59:16.722480,yes
" Are you sure?  Harley's disclaimer says, ""if you crash, we take care of the bike, you take care of you.""  If you were really responsible for the bike, did your insurance cover it? ",8,rec.motorcycles,2023-10-14 18:59:16.722480,yes
"Like Clinton and Reno, I accept full responsibility for this senseless disaster.  My wife and I picked this game to go to and thus caused the return of the pre-season-projected Sox offense.  Like all no-no's Bosio was good, lucky (hard grounder by Vaughn off T. Martinez' glove but straight to Boone who  threw to Bosio at first, 3-4-1), and backed by good defense (many non-trivial groundouts).  The game was amazingly fast, as the Sox tended to go down quickly and Hesketh was also  working fast.  The Sox relief pitching was ok -- the runs off Quantrill were on two ridiculous bloops and a hard line single which Greenwell let get past him trying for a catch.  Greenwell's mental stability is a serious concern (I guess it has always been, but his quirks were amusing back when he was an MVP candidate).  Wednesday he got in a huff with Johnson a after striking out on a bad inside pitch (apparently Johnson made an ""ok, I've got to stay focused"" gesture which Iron Mike interpreted as taunting), and struck out to heavy booing the  next two times.  As Valentine noted, last night",9,rec.sport.baseball,2023-10-14 18:59:16.722480,yes
 Did you watch the games????  ,10,rec.sport.hockey,2023-10-14 18:59:16.722480,yes
"   In Shreveport, back when I was riding the Purple Water Buffalo, I jumped an  intersection IN FRONT OF A COP who was waiting for the light!  The side of  the street he was on was hidden buy a building on the corner and I didn't  see him till I was airborne in the middle of the intersection.  I was  parked, had my helment off and my liscence out before he turned the corner.   He chewed my ass out and let me go!  I will be the first to admit it was a  very squidly thing to do, jumping the intersection like that.  The cop  should have nailed me.  I find that if you are polite, respectfull and  honest, they will normaly let you get away with a LOT of stuff.  P.S. The shock mounts folded up the next day.  I guess I deserved that!   ----===== DoD #8177 = Technician(Dr. Speed) .NOT. Student =====----",8,rec.motorcycles,2023-10-14 18:59:16.722480,yes
"So this year you had a game on SCNY, a game on SCA, a game on ESPN, and if the Rangers hadn't crashed and burned, you would have had a game on MSG.  What are you complaining about?  I seem to recall last year everyone complaining about SC coverage.  I even remember Orioles' games being shown in the DC area instead of hockey.  And what about when SC failed to show the conclusion of other games because its feature game was over?  Sound familiar?  This year I'm getting twice the coverage.  I can see all the Caps games *plus* the games ESPN shows.  I think it's great that hockey is back on ESPN.  IMHO, they're doing a great job especially considering the baseball contract they have to work around.  --",10,rec.sport.hockey,2023-10-14 18:59:16.722480,yes
"Do the Isles have another defenseman to insert into the line-up besides Pilon??? Once again, last night's STUPID penalty put the Isles in a hole for the remainder of regulation and 2 minutes into overtime!!! Even though the Isles nearly survived Pilon's blunder in regulation, it was the most inopportune time for a 5-minute major penalty. Instead of confronting Cote as he came across the blueline, Pilon backed up and swiped at Cote's nose with his stick. Al Arbour can't be serious to think Pilon is the guy to have out there with the game on the line??? I heard Scott LaChance is out till later in the series, but there must be someone else!!! Bring back the BAMMER, Dave Langevin!!!!  *******************************LETS GO ISLANDERS********************************  John Scialdone SCIALDONE@NSSDCA.GSFC.NASA.GOV",10,rec.sport.hockey,2023-10-14 18:59:16.722480,yes
"Is there a way to wax out a dull finish (minor scrathes)?  While ""passngering"" on my fiance's Bandit, my hip-pack rubbed against the tail and left a nasty dull finish and teeny scratches. Is there a way to get rid of these?  Buff them out?  Wax them out? help!",8,rec.motorcycles,2023-10-14 18:59:16.722480,yes
 Not everyone should be trusted with tools. ;-)  ,7,rec.autos,2023-10-14 18:59:16.722480,yes
 ,8,rec.motorcycles,2023-10-14 18:59:16.722480,yes
"  Hey!  What's this?  We agree!  No platoon advantage (Sabo vs. Samuel).  Both players have a reputation of being excellent fastball hitters,  and both have a reputation of being fooled too often with  slow curves and change ups.  Sabo has more power, and a little bit of a better batting eye.  Samuel  is noted as an agressive free-swinger.  Sabo has more homerun power.  Both players started the game hitting below .200.    There may have been some game considerations that might have prompted  Perez to want to reserve Samuel for use later.  But the game  *was* on the line, and Samuel never did get in.  Given all of this, I don't see a lot to suggest pinch-hitting, nor do I see anything to suggest no pinch-hitting.  There is, of course, the clutch-hitting information.  But if that's useless...  Then again.  If it's not...    ",9,rec.sport.baseball,2023-10-14 18:59:16.722480,yes
 I can vouch for this method in my 1990 SHO.  This is the only sure way of  putting in the reverse without any problem _every_ time.,7,rec.autos,2023-10-14 18:59:16.722480,yes
"  Major League Baseball is trying to expand its appeal to people with shorter attention spans (i.e. the football crowd). (-:  Invariably, all the arguments from people who don't like to watch baseball on T.V. say the same thing:  the games are too long and too boring.  Baseball is trying to find a way to shorten the games for wider T.V. appeal.  If you look at it, though, baseball games last around the same amount of time as football games.  The difference is that there is ""more action"" in that duration in football games.  Perhaps if there were ""more action"" in baseball games, you would get more of those fans to tune in.  Anyway, coming up with a solution to make baseball more appealing to a bigger crowd is going to be difficult. [On soapbox] Yet another reason to get a commisioner NOW since it's obvious that ruling baseball by comittee works about as fast as a snail race in Nebraska. [Off soapbox]  -Steve",9,rec.sport.baseball,2023-10-14 18:59:16.722480,yes
bosox-request@world.std.com to mail to the list: bosox@world.std.com,9,rec.sport.baseball,2023-10-14 18:59:16.722480,yes
How about changing team names! Post your choices!  Here I'll start: How about the  Baltimore Baseblazers San Francisco Quakes,9,rec.sport.baseball,2023-10-14 18:59:16.722480,yes
"Having had my car die on me(engine fire, insurance agent said it was probably totaled), I am in the market for a another vehicle. I saw a Toronado that was within my expected price range and was wondering if anybody could relate their experiences with me.  Namely:  1.  Does it have accceptable power(it has a 305 in it)?   2.  Does its being front wheel drive make maintenance difficult?   3.  One power window and the power seat do not work, are these   expensive items to replace if I do the work myself?   4.  How long do the engines usually last( 90M+ now)?   5.  Any other experiences good or bad, and opinions.",7,rec.autos,2023-10-14 18:59:16.722480,yes
" So you really see no problem with banning them from places to which you don't want to go?   Talk to somebody in the insurance industry, particularly after a few drinks.  Then talk to my mom (no booze required).  :^)   Ever heard of the DoD?   :^)    Nah, you just became complacent that so long as your little quarter acre is safe, you get your little tax deduction, and no act of the government intrudes, in too direct and obvious a way, into your little day to day life, you just don't give a shit. ",8,rec.motorcycles,2023-10-14 18:59:16.722480,yes
What about including points?  Probably no goals (at least against opponents) but there have been several assists given. ,10,rec.sport.hockey,2023-10-14 18:59:16.722480,yes
" On the other hand, I'm hard pressed to think of any other real mistakes Fereirra made.  Imagine indeed, but then again we have the benefit of hindsight.  Let's say that in the view of the Sharks' upper management, the attempt to trade Kisio was a major factor in the decision to fire Feirerra. I'm inclined to take exactly the opposite view:  they should have kept him...he's obviously the luckiest man in hockey!  (Wonder what sacrifice he made to the Muse of Fax?  (His job, I guess.))  have fun gak ",10,rec.sport.hockey,2023-10-14 18:59:16.722480,yes
"  I am sure some bashers of Pens fans are pretty confused about the lack of any kind of posts about the recent Pens massacre of the Devils. Actually, I am  bit puzzled too and a bit relieved. However, I am going to put an end to non-PIttsburghers' relief with a bit of praise for the Pens. Man, they are killing those Devils worse than I thought. Jagr just showed you why he is much better than his regular season stats. He is also a lot fo fun to watch in the playoffs. Bowman should let JAgr have a lot of fun in the next couple of games since the Pens are going to beat the pulp out of Jersey anyway. I was very disappointed not to see the Islanders lose the final regular season game.          PENS RULE!!!  ",10,rec.sport.hockey,2023-10-14 18:59:16.722480,yes
"On Tuesday, when it was raining in Chicago, ESPN provided  bonus hockey coverage.  Now it seems as though some fans are ticked off that the NY-Wash OT was replaced with the Angels-?? game.  People must realize that there are more baseball fans instead of hockey fans in the U.S   The baseball game was scheduled to air and advertisers money was paid so they can't skip the baseball game.  Why don't you people CHILL OUT and enjoy whatever coverage you can get.",10,rec.sport.hockey,2023-10-14 18:59:16.722480,yes
"  Sorry to be contradictory, but... I've had my Nighthawk at 45 degress with the horizon and I wasn't banked over in a turn...    The hard part is getting the front in off the ground.  I rev to about  7,000 at DROP the clutch.   Even harder is keeping it from coming up to far-- I use the back brake as well as the throttle.  Once its up, it'll wheelie just like any other bike.      ",8,rec.motorcycles,2023-10-14 18:59:16.722480,yes
 Too easy.  When you are dragging your pegs while driving in a  straight line.  Actually I've driven in 50 mph side winds with just a little difficulty.,8,rec.motorcycles,2023-10-14 18:59:16.722480,yes
"  Can you say ""*expensive*"" ? ",8,rec.motorcycles,2023-10-14 18:59:16.722480,yes
"Old Nick (the little devil!) wibbles:- % % Tsk, tsk, tsk.  Another newbie bites the dust, eh?  They'll learn. %    Newbie?  Eh?  Slap yer' credentials  on the table, Pete.  That'll  show    him!  % % I'm terribly sorry. %    And so you damned well should  be...  young whipper-snapper!  It's  wet    kippers at ten paces if there's any repeat of this sort of thing!     Now, in keeping with the  grand tradition of wreck.moto, let's  mutate!    Take your partners by the hand...     On Tuesday morning I spent a couple of hours (when I -should- have been    working) with a  torch, brazing bits  of scrap metal  over the  biggest    holes in  Yamadog's exhaust  pipes (s'mazin'  what you  can do  with  a    couple of AA  cells and a  three-volt bulb!).   I stuck some  ""gun-gum""    into the smaller holes and bunged the",8,rec.motorcycles,2023-10-14 18:59:16.722480,yes
  Many cars sold here in Finland are *small* and *cheap* cars (at least when compared to other cars --- note that we have over 120 % car tax).  And you couldn't expect a good auto mated to a 1.3 L engine?,7,rec.autos,2023-10-14 18:59:16.722480,yes
" I read that GM wants to keep the Design part of Lotus but lose the car production. And, I seem to remember, that the main problem with the Elan was caused by GM's insistence that the Elan be re-designed (significantly) for the US market which caused major design & production headaches.    Quite true - brain fade on my part. ",8,rec.motorcycles,2023-10-14 18:59:16.722480,yes
"I guess that nobody noticed that the calls during the world series (and, in fact all year) have been pretty much consistently CORRECT.  Remember: the rule says it's a strike if ANY PART of the ball passes through the strike zone.  I would certainly agree that  high strikes are not called (who could argue this point?) but all in all I think in and out is called pretty well. ",9,rec.sport.baseball,2023-10-14 18:59:16.722480,yes
" Ah well, another Brian Sutter team is ground into the dirt with intensity during the regular season and then is burned out by playoff time. Yah Fuhr has been awesome so far, but really you'd think Sutter would have learned his lesson about pushing his team too far during the regular season.",10,rec.sport.hockey,2023-10-14 18:59:16.722480,yes
   What the hell are U talking about? ESPN showed Pens/Devils game as advertised.   BUt the morons at ESPN should know that Pens will kick Devils ass and the   game will be boring. I'd rather see Boston/Buffalo game which seems to be   an exciting series since noone had expected Buffalo to get past the first   round.     Well let's hope they change their mind on THU's game and show some other   game. The Pens series is really getting boring. I want to see some    exciting game no matter who wins. If NHL wants a major network contract   then they better put some brains in ESPN people.      ,10,rec.sport.hockey,2023-10-14 18:59:16.722480,yes
"I came across this interesting information in my local public library while   researching minivans.  It is the dealer price and the retail price for a   minivan I am thinking about purchasing.  Someone told me that the number for   base price was slightly lower than the current price, but this should still   give you some idea about pricing and how much you can negotiate.   Mercury Villager GS                           Dealer     Retail Base Price                $14688     16504 Air Conditioning             729       857 Rear Defroster               143       168 Calif. Emissions              87     ",7,rec.autos,2023-10-14 18:59:16.722480,yes
Any one with experience in having a centreforce clutch (or any other) on his/her car? I'm considering to replace my old stock clutch on my 90 CRX Si. What is a fair price?,7,rec.autos,2023-10-14 18:59:16.722480,yes
" OK, here is my try:              Lukko, Finland      (look at the colors of his mask)                                 ex-JyPHT, Finland, now in Germany      Excellent defenseman       HIFK, Finland              Tappara, Finland       HPK, Finland       Jokerit, Finland               HPK, Finland              JyPHT, Finland, no new contract      JyPHT owns his player rights  All of these Czechs (Kadlec, Dolezal not anymore) are very good hockey players. It is a big surprise that Hlinka selected Dolezal.  ""Dole"" had a bad season in JyPHT and that's why they didn't make a new contract.",10,rec.sport.hockey,2023-10-14 18:59:16.722480,yes
" You don't mention your riding area.  If you're in the Eastern part of Ontario Canada, I may be able to help.  I love 1 day runs and more.  More info needed.",8,rec.motorcycles,2023-10-14 18:59:16.722480,yes
