text,target,title,date,check
"I remember a post from last year indicating that a ""pitch clock"" was tried in one of the minor leagues some time back and did not work.  I don't remember why they said that it did not work.  Anyone remember this?  Jody McDonnel on WIP in Phil. has been saying that a pitch clock was inevitable.  How would a pitch clock work on throws to first?  Another pair of suggestions: 1. Remove the Balk rule.  It is the runners responsibility to stay ""safe""    no matter what the pitcher does.  2. If a pitcher throws to an occupied base more than X time (X = 3 to 5)    without successfully picking off the runner, the runner advances a base    as if walked.  The no-balk seems to give the pitcher the advantage.  The base-walk allows the runner to ""challenge"" pitcher to throw over to the base.   I too, find myself surfing when I know that it will be enough time between each pitch to allow the batter to adjust his ""jewlery"". ",9,rec.sport.baseball,2023-10-14 18:59:16.722480,yes
"I knew, despite the lack of a full game telecast last week, it was still too much hockey for Atlanta. Atlanta's ABC has declined to pick up any playoff games till May9. And even when they show the games on MAy9 and May16, they will continue to skip the first half hour of the telecast. I know this is still a better situation compared to rest of Georgia, Alabama, etc., but it is still pretty annoying. At least in PIttsburgh, we had a network preemptionchannel which showed all netwoork shows prempted by the local affiliate.   I asked them what their problem was. I told them that a local 1.9 rating was not that bad considering it was the first NHL game shown after a long time without much promotion. Besides, their syndicated programming in the afternoon is usually low rated. So what did they have to lose by showing NHL playoffs. She told me that they had contractual obligations. I asked her if golf was shown oin ABC, would contractual obligations come in the way. And how come contractual obligations didn't come in the way of last week's telecast? She then couldn't give me a coherent answer. ",10,rec.sport.hockey,2023-10-14 18:59:16.722480,yes
" - - I heard a story on the local sports news broadcast in Edmonton. - Oiler owner Peter Pocklington will be holding a press conference - next week. While the exact details are not known, it is believed - to concern the Oiler's future. - - Rumour has it that Pocklington signed a tentative lease arrangement - with Copps Collesium in Hamilton. During the press conference, - Pocklington may announce the deal. It is quite possible that - the deal may simply be a way to force Edmonton Northlands to - renegotiate the Oiler lease on the stadium. - - Northlands has offered to buy the Oilers for $65 million earlier, - but the offer was rejected immediately by Pocklington. - - As for me, my opinion is divided... Edmonton has been fairly - supportive of the Oilers. Even though they're a small market - team, they had many sellouts in the 80s. Even with the problems - that the team had this year, they still brought in more fans - than many teams in larger cities did. On the other hand, if - the team does move, there is no place more deserving than - Hamilton. Of course,",10,rec.sport.hockey,2023-10-14 18:59:16.722480,yes
"                                           ^^^^^^^^^^  Zounds!  There's a blast from the past indeed!  I'd nearly forgotten about the strategic significance of strabismic in r.m lore.  It's really good to see it proudly displayed again, although I'm sure by now that its carbs are spooge-o-rama from long disuse.  Gosh, I'm tingling all over!",8,rec.motorcycles,2023-10-14 18:59:16.722480,yes
"  Don't forget Robert Blake in ""Electra Glide in Blue"" (where else do you get to see a full-dress Harley playing with dirt bikes?). And if you're going to count Smokey and the Bandit, then you darn well better include ""Pee-Wee's Big Adventure"".   ",8,rec.motorcycles,2023-10-14 18:59:16.722480,yes
"  Low oil pressure, usually.  Could be your oil pump, or... checked your oil lately???  MC",7,rec.autos,2023-10-14 18:59:16.722480,yes
                                                           ~~15 ,7,rec.autos,2023-10-14 18:59:16.722480,yes
325/441/577.  ,9,rec.sport.baseball,2023-10-14 18:59:16.722480,yes
"  But, Gary, for certain sofa tubers like myself, this is an advantage.  I can watch the Pirates on KBL, the Mets on WWOR, the Braves on TBS, and the mediots on ESPN at the same time, without missing anything.  (If something impressive happens, I'll catch the replay :-) ).  So, I see (essentially) 4 games in 3 hours, instead of 1 game in 2 hours. What a deal!  (Insert smileys as desired...)  ",9,rec.sport.baseball,2023-10-14 18:59:16.722480,yes
"     writes...     Oh, probably.  Ms. Nichols has given the average game times (and average runs scored) for 1983 and 1992.  (A very nice piece of information, Ms. Nichols.  Who knows? She may be listening, and not have me in her kill file after all.)  Those numbers indicate somewhere in the neighborhood of half-a-run *less* being scored per game, and the games taking 15 minutes *longer*.  Something is being done now that wasn't done ten years ago, which is extending the games by 15 minutes.  Ms. Nichols thinks it's more pitches.  Given the increasing specialization of pitchers, it wouldn't surprise me.  If it's not simply more pitches, though, I don't think it's unreasonable to think that something can be done to get ten of those minutes back.  Then I get a couple more from shortening the warmup time for a relief pitcher after he comes in, and a couple more still from enforcing existing rules, which have been stated in other posts in this thread (and other related ones).  The problem is, who decides whether that time is ""wasted?""  You don't seem",9,rec.sport.baseball,2023-10-14 18:59:16.722480,yes
"        Well, in my opinion the Canucks played a really strong game. I was especially pleased by a very strong game from Linden - I think he could be a key to success for them this year.  Defensively, they really had a strong game.  Hardly heard Selanne's name all night. Craven also played one of his best games since coming over.  With a few exceptions, they really didn't let the high-flying Jets do much high-flying.  I thought the Jets defence looked overmatched by the Canucks forwards - they will have to improve on that if they want to make this a series.      In short, it was a great start! ",10,rec.sport.hockey,2023-10-14 18:59:16.722480,yes
" Hmmmmmmmmm. I can read this one of two ways:  1) Ed gotabike. 2) Motorcyclist is like alcoholic. (once you're an alcoholic, you're always an                                     alcoholic - at least that's what friends in                                     a position to know tell me)                    tom coradeschi <+> tcora@pica.army.mil",8,rec.motorcycles,2023-10-14 18:59:16.722480,yes
" I can't let this pass. *If* the Islanders get past Pitts. (Assuming the Isles beat the Caps, God  Willing), them I'm sorry, the Isles will crush the Leafs. Flame shields up.  ******************************************************************************** Of course no one asked me I always interject my opinions on matters I have no  concern over  -------------------------------------------------------------------------------- Go Islanders!!!!!! (3 down, 1 to go) Go Jets for '93 ******************************************************************************** ",10,rec.sport.hockey,2023-10-14 18:59:16.722480,yes
"Has anyone any experience with the (new?) Yamaha Cyclelok ?  It looks like it uses the same hardened steel as a Kryptonite U lock, but unlike a U lock, it is hinged in 5 places and opens out to a large rectangle (longer length than any U lock I have seen, plus it folds down to real small), so you could lock the rear tire to a steel post for example.  I was curious as to how well the jointed sections would stand up to attack ?  tony",8,rec.motorcycles,2023-10-14 18:59:16.722480,yes
"  You wouldn't have to put my name at the bottom if you simply appended a  standard disclaimer that the opinions expressed in your petition in no way claim to represent the views of either rec.sport.hockey or the internet as a whole.  You have surely seen these disclaimers appended to the postings of many who work for companies and post on the net.  The disclaimers, clever though some of them may be, are there for a reason.    -- ",10,rec.sport.hockey,2023-10-14 18:59:16.722480,yes
" I looked up ""might"" to see why you selected that particular word, and discovered the line "". . . to express permission, liberty, probability, possibility . . .""  It also said something about being a ""polite"" alternative to ""may.""  The presence of ""probability, possibility"" can certainly be used to partially explain your word selection.   So, I'd say to all extents and purposes, ""Yes, you might.""  In fact, you did. (Not that you were asking *me* specifically.)   The next question is, why would a mailing list be ""more"" appropriate? We don't all get mailing lists.  We surely don't all get mailing lists about the teams about which we are most enthused.  So it seems to me r.s.baseball is an appropriate place to look for information about teams one doesn't necessarily follow day-to-day.   This is not intended as flamage, but rather is an attempted answer, as you posed your post as a question.",9,rec.sport.baseball,2023-10-14 18:59:16.722480,yes
"(...) (...)  Att man skulle bli tvyngen att {ndra premisserna kunde man inte lista ut p} f|rhand. Huvudsak att man inte flyttar *ner* fel lag. \stersund var en solklar fix som sagt, men V{stervik!! Att det beror p} Nyk|ping tror jag inte p}, man kunde ju lika g{rna ""flytta ner"" Roma till s|dra (iaf om man g}r efter bredgraderna). Mest r{ttvist vore att l}ta Tierp och V{stervik g|ra upp, men d} skulle Roma/Nyk|pinks vara eller inte vara i |stra ocks} avg|ras. Vad skulle de s{ga om det? Det st|rsta felet med }rets indelning {r *exakt* samma som f|rra }ret, fast v{rre. DET [R INTE R[TVIST INDELAT, sportligt sett. Vallentuna var en match fr}n att g} upp till Allsvenskan f|rra }ret ist{llet gick  G{vle upp. Tror ni n}n av dem lyckas lika bra i }r? AIK, HIF, SSK och HIK ska sl}ss om tv} platser!! Om man hadde placerat dessa i var sin division skulle de vara sj{lvklara favoriter till en plats i Allsvenskan, men nu m}ste tv} ge vika. Var finns r{ttvisan i det? :-( Jag har h|rt att HIK har l{mnat in en protest till f|rbundet ang{ende indelningen i |stra. Mitt f|rslag vore att l}ta 3:orna i",10,rec.sport.hockey,2023-10-14 18:59:16.722480,yes
"  Er..yes.  If Manny Lee was on your team last year, your team would have been the Toronto Blue Jays.   Again.  If Manny Lee was on your team last year your team would not have been the Albuquerque Leftturns.  It would have been the Toronto Blue Jays.   That's the whole point isn't it?  Clemens didn't get a ring but Morris did.   Exactly.  And Morris was part of the team.  Would the Jays have won with  Clemens?  We will never know.  But we do know that the Jays won with Morris. So how could you possibly say that Clemens had a better year?  No pitcher in baseball could have had a better year than Morris had last year.   -- ",9,rec.sport.baseball,2023-10-14 18:59:16.722480,yes
"[ Article crossposted from sdnet.forsale,rec.motocycle ] [ Author was Michael James ] [ Posted on 21 Apr 1993 15:39:50 GMT ]   I must sell my motorcycle...:(  it is a '83 GR650, Tempter. It has 20K miles and runs well.   Includes a cover and tank bag..  I'm asking $700 for it all.   E-mail me if you want to take a look at it.  -- ********************************************************************************  Michael James                   james@mintaka.sdsu.edu            PA-128      594-2469         294-9845(H)  ******************************************************************************** ",8,rec.motorcycles,2023-10-14 18:59:16.722480,yes
"  let me clarify, i think they both are 2.0 litres. ",7,rec.autos,2023-10-14 18:59:16.722480,yes
"  I had a similar experience.  We had a written quote which had been mailed to us from the salesman at one of these ""no-haggle"" Toyota dealers for a Camry XLE w/ABS, leather, etc.  The price seemed fair, but when we went in to take them up on their offer, they ""discovered"" that certain extra cost items hadn't been included in their original written quote. It would have totaled an extra $1100 and, in spite of the fact that we had a written quote, they said there was nothing they could do.  Bottom line, quotes from salemen are worthless and it appears to me that the Toyota dealers think they've got such a superior auto that they don't have to deal.  We walked, went out and bought a new LH car (Eagle Vision TSI) and I don't regret it one bit! ",7,rec.autos,2023-10-14 18:59:16.722480,yes
" Tickets are very hard to get, even at the box office at Camden Yards. If you really want to see a game here (I go to school in Baltimore), price should not be an issue. Tickets go up to $15, but you should be willing to go as high as $20-25 if you really want to come.  ",9,rec.sport.baseball,2023-10-14 18:59:16.722480,yes
"  The USA Today says ""late this year"".  The question is, will hockey be moved to ESPN2 permenantly, or will it be where they have a game of the week on ESPN, and have a bunch of other games on ESPN2?   --  Mike Cornell     | ""There are a great many people in the country today who, mac18@po.cwru.edu|  through no fault of their own, are sane."" -Monty Python",10,rec.sport.hockey,2023-10-14 18:59:16.722480,yes
"Tim Shippert recently posted summaries of last year's Defensive Average stats in terms of the Linear Weights estimated run-value of defensive performances, compared to league average.  I've combined those with my position-adjusted MLV numbers to come up with first-approximation total run values for players last year.  We can use these as a springboard for reconsideration of the MVP award.  Major caveats:  these numbers include no defensive park adjustment, so if San Diego really is just a question of odd scoring or gopher holes in the infield, that will cause some inaccuracies.  The offensive numbers are position-adjusted, but not park adjusted, so we have to deflate some and inflate others to be fair.  Finally, we still don't know what to do about catchers, and I have no idea how to evaluate the defensive contributions  of Tony Phillips and Bip Roberts.    Having said that, there are still some surprises.  Let's look National League first.  All numbers in total runs contributed over the season.   Player  Offense  Defense  Total   Sandberg   44    32   76  Bonds   ",9,rec.sport.baseball,2023-10-14 18:59:16.722480,yes
"What's the best lease quote that anyone has seen on a Toyota Previa DX or DX All-trac for a two-year lease?  If you know where I can get a better rate than $330/month, please contact me with the name and phone of the dealership. ",7,rec.autos,2023-10-14 18:59:16.722480,yes
"Deloreans NEVER had a factory V8.  They were considering production with a turbo (or twin turbo, I forget) version of the standard V6.  As to who produced it, you got me!  Jonathan",7,rec.autos,2023-10-14 18:59:16.722480,yes
     They did last world cup and eventually lost tp Sweden in the final!,10,rec.sport.hockey,2023-10-14 18:59:16.722480,yes
"I recently sold my Nighthawk in order to upgrade to a zippy little sport bike.  I am, however, partial to the bigger zippy bikes like the GSX-R 750.  There is only one in my town for sale, and he is not sure whether he wants to part with it or not!  Please send me email if you would like to sell yours, know of one for sale, or could just offer details on the performance of yours even if you wouldn't sell.  I appreciate any help!  THE HYPEMAN",8,rec.motorcycles,2023-10-14 18:59:16.722480,yes
" Ron> Viper also sells some fancy field disturbance sensor that Ron> supposedly detects people approcahing the car....  Ron  If your Viper system were tuned like a neighbor's is you wouldn't get any sleep because of the damn thing waking every one in the neighborhood up.  We all used to try to ignore the alarm, but have now made a pact to bombard the house with night-time visits and phone calls when ever we are awakened because some thunder storm passed over the next county or a stray dog looked at the car.  Car alarms are a serious pain-in-the-ass!        -ks  p.s. Real men don't have car radios since the exhaust is too loud to      hear it anyway <GRIN>! -- ",7,rec.autos,2023-10-14 18:59:16.722480,yes
  Another tip is to make sure you keep well to one side of the lane. This gives you a quicker escape route.,8,rec.motorcycles,2023-10-14 18:59:16.722480,yes
"  Either I've just fallen for this, or you guys are _really_ paranoid!  You're actually worried about somebody stealing  your oil?  C'mon, you think a vandal'll do that?!  That's absolutely ridiculous!  Besides, how hard is it to get under the car to  change the oil?  I can say from experience on the cars that I've driven and changed the oil on, my Mazda 323 is pretty much a pain, but once you've done it once, you don't forget how, and it gets easier.  I can't imagine any other cars are much worse than mine. ",7,rec.autos,2023-10-14 18:59:16.722480,yes
"that his positive.   Clint Malarchuk     What has happened to him since?   Assigned to San Diego Gulls at the being of the season I believe    What  It was Uwe Krupp and a Blues player, though Uwe's skate I beleive cut   Clint.  He has since be traded to the Isles in the LaFontaine deal.    Has this ever  This is the only time I know of.   ",10,rec.sport.hockey,2023-10-14 18:59:16.722480,yes
"  For an expansion team?  I'm pretty sure I would go with the rings, as long as their salaries and ages weren't too high.  I would want the fans to be  able to identify the players.  I would like a championship attitude in the  clubhouse.  As for Larkin and Griffin?  Salaries aside, I would have to consider which player is likeliest to contribute to a WS victory.  Past performance, age and attitude would all be integral to my decision.  I certainly wouldn't just haul out my copy of Gillete and pick Larkin, as many others would.  And, unlike many others who post to this group, I hardly consider myself quali- fied to make those kinds of decisions.   I have never been able to believe it about myself, to tell you the truth. It's like banging your head against a stone wall.  -- ",9,rec.sport.baseball,2023-10-14 18:59:16.722480,yes
"     Roger, you should check your facts before posting! The Kings have  conceded 12 goals in 2 games. ",10,rec.sport.hockey,2023-10-14 18:59:16.722480,yes
" I'm familiar with the telethon situation (an individual on CompuServe was also victimized and was equally pissed).  That was a local television station contract which could not be broken.  For that item, I strongly suggest you call that affiliate and vent your anger on them.  (Supposedly one station had told my friend that they have received hundreds of angry calls which will translate into far less incentive to pre-empt hockey telecasts in future.  The contract was written when the pathetic WLAF was in that time slot.)",10,rec.sport.hockey,2023-10-14 18:59:16.722480,yes
" *Everything* in Louisiana is related to liquor:  eating, sleeping, walking, talking, church, state, life, death, and everything in between.  Plus the food is good, too.  ",8,rec.motorcycles,2023-10-14 18:59:16.722480,yes
    The Delorean used the Peugot/Renault/Volvo V6 in a rear engine configuration. The Bricklin use some 'Merkin iron in a front engine/rear drive configuration. ,7,rec.autos,2023-10-14 18:59:16.722480,yes
"   Car accessory shops here sell stuff called T-Cut, which is a very fine cutting paste for paint, and this will remove the dull finish and minor acratches. It will also remove all the traffic film and stuff that you probably don't realise is there, and give your paintwork its original lustre and shine. It can sometimes react badly with metallic paint, though, so try it out carefully before going to town with the stuff. Afterwards apply wax polish, and all will be well again.  BTW - don't confuse T-cut with the cutting paste used for grinding in  valves...the principle's the same but the coarseness is vastly different...",8,rec.motorcycles,2023-10-14 18:59:16.722480,yes
" One more good reason for straight pipes or megaphones;-)  Regards, Charles DoD0.001 RZ350  Ps: Does anyone know if Opti oils sells direct by the case load? My loacl dealership is charging 12.99 for a jug of injector oil, and it's breaking me;-) ",8,rec.motorcycles,2023-10-14 18:59:16.722480,yes
"     ^^^^^^^^^^^^^^^^^^^^^^^ ^^^^^^^^^^^  Hopefully EPSN will use the lesson given by the master: Ted Turner. The season Ted introduced TNT, many cable co.'s refused to put it on, saying that, gee we get enough old movies, miniseries, etc. on TBS, USA, AMC, WGN, WOR, why do we need another one? This was in the fall. Come spring, Ted fixed their little red wagons good. The previous spring, NBA playoffs wore on TBS, now they were on TNT (and still are). And everyone gets TNT now.  So, ESPN should put NFL football and baseball on ESPN2, and leave hockey on ESPN. And if cable co.'s play games and drop ESPN in favor of ESPN2, ESPN should alternate baseball and football between channels every week.  But, do the ESPN guys collectively have the gonads of the Turner guy?",10,rec.sport.hockey,2023-10-14 18:59:16.722480,yes
"  Someone on the minor league mailing list probably does.    I do, but I don't have time to type the whole thing in (I don't mind looking up specific date ranges or individual games when I can, but there are limits).   Besides, this stuff is EASY to find. Baseball America puts out a book called the Directory. It's $10(US). Has every team's data and schedule in it. If I WERE to type in the whole scheudle, I'd just be spending a lot of time infringing on their copyright.  Folks who are interested in the minors should check out my minor league list (see the signature), and folks who are tracking down team schedules should chec out the BA Directory. You can order it from 800-845-2726. I find it indispenable.  ",9,rec.sport.baseball,2023-10-14 18:59:16.722480,yes
"  My agent is Daniel Sui, and he's done quite a good job  for me.  You might check with him, as he's located in San  Francisco and specializes in bike insurance:    Daniel Sui Insurance   338 Balboa Street   San Francisco, CA 94118   1-415-752-3157       Michael  ",8,rec.motorcycles,2023-10-14 18:59:16.722480,yes
I am thinking of buying a used Audi 90 Auto.  These cars look good and Audi do have a good rep. for these cars in Europe (where I'm from).  I was just wondering if there anything about these cars that I should know.,7,rec.autos,2023-10-14 18:59:16.722480,yes
" For those of you who complain about Don Cherry, and wonder why he is popular...  the reply is Dick Vitale and John Madden and Bobby Knight and Joe Garagiola and Howard Cosell.  John Madden picks Gary Clark of the Redskins for his All-Madden team a lot, over much better receivers...for much the same reasons Cherry sings the praises of Doug Gilmour...a little guy with heart...yet one doesn't see a string of American posts saying that John Madden has lost his marbles.  Dick Vitale is always promoting this kid from this high school or that college with outrageous statements.  Why should Americans expect that Canada would not have such characters in relation to our greatest passion...which is hockey?   Canadians are very similar to Americans...culturally our sports are just hockey and curling, whereas with Americans it is football/basketball/baseball and bowling.",10,rec.sport.hockey,2023-10-14 18:59:16.722480,yes
" [Some discussion about whether Elias is money grubbing deleted]      Some thoughts and facts,  1.)  Bill James is a partial owner of STATS, inc.  However he has almost nothing to do with the day-to-day operations of the company, although he does have significant input into the design of the books that bear his name. (The handbook, but not the scoreboard).  To the best of my knowledge, the only things that Bill actually writes for STATS are the predictions section of the handbook, and the Bill James Fantasy Baseball rulebook.  2.) The debate over Elias goes way back.  Bill James' early stuff was hampered by the fact that Elias would not give access to their stats at any price. Project Scoresheet, and later, STATS were founded to fill this void.  You can call STATS, and ask them for a report on just about anything in their database, and they will provide it -- for a price, of course.  Or you could just log into their online system and look at the data yourself.  Having attempted to pry numbers from Elias in the past (football, not baseball), they",9,rec.sport.baseball,2023-10-14 18:59:16.722480,yes
"      I know the roads up there in Minnesota are pretty bad, but I doubt that they are THAT bad.  I've never realy tried to watch my back tyre but, my 82 Maxim 750 will pull the front wheel off the ground if I pop the clutch. Admittedly, it is easier with someone on back, maybe that's what keeps the rear tyre down.  ;-)   ",8,rec.motorcycles,2023-10-14 18:59:16.722480,yes
"  Yeah, they finally came to agreement on a contract. As soon as the ink was dry, he suddenly decided Kansas City was a neat place to be. (ergo, the ""want to play for the national team"" was a bargaining chip). ",10,rec.sport.hockey,2023-10-14 18:59:16.722480,yes
