text,target,title,date,check
"  I would be veru interested also, if there is one. Could someone please send me some info?",9,rec.sport.baseball,2023-10-14 18:59:16.722480,yes
   Sounds like you are getting a pretty fair price (assuming it is in nice condition)  ,8,rec.motorcycles,2023-10-14 18:59:16.722480,yes
"  Ah, but the illusion in football is that there is always lots of action and a sense of urgency because of the game clock (not all the time, but it happens when there's less than 5 minutes to go quite often).  This sense creates drama, even when there may not necessarily be any and that holds a viewer's attention.  In baseball, only 3 players are involved in the action for about (here comes a wild guess) 70% of the time?  And they're just playing a sophisticated game of catch/hold-the-ball/step-out-of-the-box/adjust-chains/ touch-self-in-interesting-locations.  There's a lot of ""dead time"" with the players warming up between innings or the manager visiting the pitcher at the mound or the manager removing the pitcher and bringing in a relief pitcher who then takes (8? 10?) pitches or Helen Dell playing the organ (Dodger fans will appreciate that one).  To the non baseball junkie this is boring. At any rate, I'm not putting baseball down for this - I've been an avid fan since I can remember - it's just that watching a baseball game on T.V. at home can be tedious for the non baseball junkie.  That's what",9,rec.sport.baseball,2023-10-14 18:59:16.722480,yes
"(Ali's letter deleted for brevity)   Roger, Your responses might just exclude you from sharing your opinions, then.  You see, the same rights Ali has to mail her letter to the NHL are the same ones that let you post replies that mow her down like wheat at harvest-time.  She never said she represented the entire internet or the entire group rec.sport.hockey.  She has every right to state her opinion along with those of the fifty or sixty or hundred-odd folk who've agreed to allow her to list their names on the bottom of it.  You may not agree with it.  Fine.  I really don't care enough about the name change to care.  Your name isn't attached to it, so why moan and complain?  If you felt her words were leading, well, you're free to feel that way and take exception, but manners never hurt.  I personally disagree and feel her generalizations were fine (I have the right to think and say that, too).  Ali's under no compunction to change a single word.  Now, while you're free to disagree with every word she wrote, to tear apart her",10,rec.sport.hockey,2023-10-14 18:59:16.722480,yes
"Just a quick, simple question really...   How many wheels are affected by the emergency brake on an '86 Nissan Maxima. I've heard that all four are affected, but this would seem unusual to me. I thought the emergency brake on most cars only affected the rear wheels. Also, how powerful is the emergency brake usually? Enough to lock wheels at 30mph? Hmmmm... I just have to wonder about some of the things I hear...",7,rec.autos,2023-10-14 18:59:16.722480,yes
"  You are sure that what you call a 200SX we call a 240?  Just curious.. We also have a nissan predacessor (sp) to the 240 called a 200, which came in turbo and nonturbo.  But i don't think we've ever had a 240 turbo...just curious...(BTW, I'm in the US, if that matters..)",7,rec.autos,2023-10-14 18:59:16.722480,yes
 Highway 12 is a great road.  Be sure to stop by the Anasazi (sp) village museum near Boulder Creek.  Interesting lifestyle :-).  The views of Dixie  National Forest are stunning.,8,rec.motorcycles,2023-10-14 18:59:16.722480,yes
"            Go the speed limit.  As long as your not at the salt flats, you arn't gonna  frag yer ride.  I wouldn't ride the DoD minimum until it had 500+ miles on  it, but hell, I do that on a good weekend!   ----===== DoD #8177 = Technician(Dr. Speed) .NOT. Student =====----",8,rec.motorcycles,2023-10-14 18:59:16.722480,yes
 Such as?,10,rec.sport.hockey,2023-10-14 18:59:16.722480,yes
   ,8,rec.motorcycles,2023-10-14 18:59:16.722480,yes
"     Vintage Brakes     176 Bluefield Ave.     Newbury Park, CA.  91320     (805)498-5527      They reline all types of obsolete motorcycle brake shoes with Ferodo material.       Place to try:      Deutsches Motorrad Register     8663 Grover Place     Shreveport, LA 71115     (club for all types of two-wheeled German equipment, including      scooters.  I periodically see ads for Maico scooter stuff in their      newsletter.)  -----------------------------------------------------------------------------",8,rec.motorcycles,2023-10-14 18:59:16.722480,yes
"In response to Jerry Lotto's post about not putting your helmet on your mirror or else risk damaging the padding from the inside.  One of the major causes of mirror breakage is impact with the pavement. Laws mandating that all mirrors be protected by helmets might be in order. But seriously...  One place to put a helmet is on a, preferably clean, footpeg, hanging from the chin-guard, away from any hot pipes.",8,rec.motorcycles,2023-10-14 18:59:16.722480,yes
" Yeah, it's impossible to be a tough biker when a 5 year old starts waving at you. ",8,rec.motorcycles,2023-10-14 18:59:16.722480,yes
"useless which of and a  But ingnoring putouts is biased in yet another way. Range is not the only thing that makes a good firstbaseman. The ability to field all sorts of balls thrown to him: digging some out of the dirt, stretching for others, and so forth is important. Thus,  putouts do provide some information.  Maybe what we need is a comparision of how many balls were thrown to the area of the first baseman vs. how many he actually got.  ",9,rec.sport.baseball,2023-10-14 18:59:16.722480,yes
" Don't expect to get top quality, just some toughness.  I don't  view Makarov as a player who would add toughness.    Nelson, you're confusing skill and toughness.    Hey, get off the McGill/Hammond thing.  I'm no fan of either. My  point is that last year the Sharks had toughness that was missing  this year.  This year we had more skill, I'm all for that, but  if your skill players keep getting beat up and injured they  can't do you much good.  Whether it's a cheap shot or not you  can't let the other teams push you around.  The 1992-93 Sharks  simply got pushed around to much.  Other teams knew this.  They knew they could aggressively check the Sharks and not  pay for it.   Adding some players in the off season who will  add some toughness to the team will help insure that next  season other teams will be more hesistant to vigorously   check our skill players, or to take cheap shots.  It doesn't  guarantee no injuries (nothing does), but it's something the",10,rec.sport.hockey,2023-10-14 18:59:16.722480,yes
"Dear Anybody,  I am in Rochester, NY, where people can look at a Rangers-Penguins playoff game and say, no joke I heard it, ""Hey whats this, OH, its not even the AHL, its just the NHL, I think.""  Because of this e get Red Wings (Orioles AAA) stats and updates but no AL or NL stats.  Specifically Im looking for Red Sox stats so far, Id like all of them, but could handle just Greenwell and Vaughn.  CAN ANYBODY PLEASE HELP ME!!!!!!!!",9,rec.sport.baseball,2023-10-14 18:59:16.722480,yes
 vvvvvvvvvvvvvvvvvvvvv  VVVVVVVVVV  Getting close there!,8,rec.motorcycles,2023-10-14 18:59:16.722480,yes
" And won't they have to change their name to the ""Steelers"" or something. The only significant deposits of oil around Hamilton are those caused by the tire fire a  few years back.",10,rec.sport.hockey,2023-10-14 18:59:16.722480,yes
"I would appreciate it if someone could volunteer to verify the shots on goal and save percentage numbers for me, so I can put these stats on the archive site.  Contact me by mail if you want to volunteer.  Here are the team goalie stats as of: Wed Apr 21 09:09:38 CST 1993  These stats include games up to and including the Sunday previous to the date listed above.  They have been verified against what is printed in my newspaper every Tuesday.  They don't print shots and save percentage numbers, so those are not verified.    If you have any questions, comments or suggestions, let me know.  Randy  ------- MP = Minutes Played, GA = Goals against, SO = Shutouts, GAA = Goals against average W = Wins, L = Losses, T = Ties SOG = Shots on Goal, SV = Save Percentage   MP   GA SO   GAA  W  L  T  SOG   SV  TM Player ======================================================= 4106 177  7  2.59 41 18 11 1879 0.906 CHI Ed Belfour  996  49  2  2.95 ",10,rec.sport.hockey,2023-10-14 18:59:16.722480,yes
    ,7,rec.autos,2023-10-14 18:59:16.722480,yes
Thanx Craig.... in addition to Craigs coments - and to clear up any  further confusion.... the 200SX (of USA) was reffered to as a Silvia Turbo in the UK.... performance figures of UK 200SX are:,7,rec.autos,2023-10-14 18:59:16.722480,yes
"folks,  i am going to be purchasing a new vehicle in the next few months.  i am trying to hold out until the fall since i have heard that i can be in a better negotiating position to purchase a '93 right when the '94s are coming out.  i need something that can comfortably carry 2 adults, 2 kids in car seats, and 2 60-pound dogs.  i can probably afford something in the 14k-16k range.  i am interested in the SUV's but am not sure there are any that are decent which i can afford. i think the ford explorer got good reviews from consumer reports but is above my $$$ range.  the isuzu rodeo is probably in my price range but i think consumer reports gave it a big thumbs down.  can anyone offer any suggestions?  i am hoping for something a little more hip than the traditional wagon, and the SUVs look like fun (we do a lot of camping too).",7,rec.autos,2023-10-14 18:59:16.722480,yes
" Some of us aren't that fucking stupid you cock sucking asshole.  That's why we haven't had our own little DD suaree.  I'm soo impressed that you've had to spend your own precious little dollars  to make up for your own stupid act.  Now go fuck off.    Friends killed by Drunk Driving Assholes like Andress Infante:  2 Children friends orphaned by Drunk Driving Assholes like Infante: 2    Now who's the self-righteous asshole, you weak willed fuck head?  ",8,rec.motorcycles,2023-10-14 18:59:16.722480,yes
"...  That is if Mario makes it.  Pat Walker sounds like the type that would bring an AK-47 to a game and take pot shots at Mario. (""stand STILL...dam sunavbich...HMFF"") ",10,rec.sport.hockey,2023-10-14 18:59:16.722480,yes
" You must be kidding, right? In losing Stevens the Blues got Shanahan and kept Joseph. Then they traded Oates for Janney. As a Hawks fan you have got to respect those ""hapless"" names. 8^) Lets see, who scored the game winning overtime goal in the 4th game???  ",10,rec.sport.hockey,2023-10-14 18:59:16.722480,yes
   And my '78 CX500 too - I first thought it was the wiring diagram that didn't fit MY machine ;-) ,8,rec.motorcycles,2023-10-14 18:59:16.722480,yes
"This comes indirectly from Al Morgani who works in the studio for ESPN hockey.   The management of ESPN was reluctant to leave the Pitt-NJ game  (even though the outcome was certain) because of fear of the Wash-Ny game  going to overtime.  When the Caps scored with :02 left to tie the game, Al said he heard many people say f**K .!#$%.    ESPN is under contractual obligation to show baseball and COULD NOT broadcast the OT of the hockey game.  Next year, ESPN2 will be introduced so  baseball fans can watch baseball and hockey fans can watch hockey.   GET OFF ESPN'S BACK AND STOP POSTING ARTICLES ON THIS SUBJECT!!! There have been to many f****n complainers about this game that it's making me sick.",10,rec.sport.hockey,2023-10-14 18:59:16.722480,yes
"I watched the game Germany-Czechs in WC today...and i was astonished about the behaviour of the German audience! The German team got a few penalties in the last period and the crowd went grazy! They threw coins, extra pucks and other trash into the rink...is that stupid or what?? I guess the Canadian referee (one of the Isostar-bros ;) gave the German team a penalty for that, but it didn't help much. I guess the Germans just are proud over their Nazi-Kill-'em-All-Everyone- But-Us-Germans-Sucks attitude...they just seem to have that kind of attitude in every possible sport (remember the European champs in Stockholm in soccer) It really pisses me off! I do not mean that every single German has this attitude that sucks, but  most of them seem to do...",10,rec.sport.hockey,2023-10-14 18:59:16.722480,yes
"This summer (~July 20) my wife (Michelle) and I will be in Boston attending my brother's wedding.  After the wedding we are planning to motor up to Bar Harbor, Maine to visit some relatives for a few days.  Our summer would be *made* if we could find a bike (or bikes) to borrow or rent to ride up to Bar Harbor and back.  Here's some important details:  I've been riding for ~11 years, (my own bikes for the past 7 years), Michelle has been riding for the past 6 years (her own bikes), I've only been involved in one accident which was caused by a cage driver running a stop sign, I currently own a BMW R90, Michelle owns a Yamaha Virago 700, we prefer cruising over racing, we've toured a fair amount, we're both licensed and insured, and we're nice people.  So, if anyone has a bike (or bikes :-), but the second one would have to be a Virago or something else with an equally low seat) that they would be willing to loan us for 3-4 days in July, Michelle and I would be eternally grateful. In addition to our friendship, you",8,rec.motorcycles,2023-10-14 18:59:16.722480,yes
"since at least one other person was interested in this:  my FZR's black exhaust pipes are rusty and i researched getting them repaired. yesterday i bought a can of VHT 1500 degree black header paint and spent an hour sanding two of the header pipes by hand.  sprayed on paint.  thought about how clean i was able to get the metal with sanding and determined that i wouldn't be at all suprised if the paint wore/chipped off in a month.  soooo call a couple of places up in minneapolis and discover that powder coating, while extremely durable, will not handle over ~600 degree temperatures.  the place i talked to said they were experimenting with some new powder that is supposed to handle 1100 degrees but that it wouldn't be available for months at least.  they directed me to another shop that specializes in header coating.  the other shop said they have 2 coatings available.  one is aluminized that can do 1200+ degrees and is ""comparable"" to powder coating for durability. the other is silicon (i think) based and can do 1800+ degrees (!) but is thinner and not as durable.  both",8,rec.motorcycles,2023-10-14 18:59:16.722480,yes
" They changed the lights and slope of the hood, along with the new grille.  Otherwise, it is unchanged.  Interestingly, their lack of wood and lack of a grille was a BIG design statement... they tried to defy conventional wisdom and carve their own niche ... unfortunately, sales were only half those of the LEXUS and hence, they now join the pack.  I still wonder if much of the problem wasn't the slow start from the initial AD campaign.  Personally, I like the Q without the Grille.",7,rec.autos,2023-10-14 18:59:16.722480,yes
 ordered 2 fork seals and 2 guide bushings from CA for my FZR.  two weeks later get 2 fork seals and 1 guide bushing.  call CA and ask for remaining *guide* bushing and order 2 *slide* bushings (explain on the phone which bushings are which; the guy seemed to understand).  two weeks later get 2 guide bushings.  *sigh*  how much you wanna bet that once i get ALL the parts and take the fork apart that some parts won't fit?,8,rec.motorcycles,2023-10-14 18:59:16.722480,yes
"Good point - there haven't even been any recent posts about Ulf!  Secretly, I'm convinced that he's responsible for the Bs being down 3-0 to Buffalo, somehow. ",10,rec.sport.hockey,2023-10-14 18:59:16.722480,yes
" I think it was the reverse, the V4 being 2/3 of the V6.   It was also the worst engine that Ford (Europe) have ever made - bloody awful reputation. It's most successful application being the Transit van.  Saab gave up with this motor and then made the Triumph 1854 (half a Stag V8) under license (I believe), but with 2-litre capacity and perhaps a different arrangement for the cylinder head studs, before developing their own straight  four from the Triumph.",7,rec.autos,2023-10-14 18:59:16.722480,yes
" So you think a 93 Mustang Cobra can match the performance of a new Z28?? Interesting belief!   Craig  (who neither owns, nor wants to own any GM or Ford product)",7,rec.autos,2023-10-14 18:59:16.722480,yes
"Oakland, California, Sunday, April 25th, 1:05 PM PDT:  Jose Mesa vs. Storm Davis.  You have been warned. ",9,rec.sport.baseball,2023-10-14 18:59:16.722480,yes
" ---------------------------------------------------------------------------------  As far as I know, a save opportunity is when it is 7th inning or beyond, and the batter on deck can either tie or win the ball game.  For example If it is the bottom of the 8th inning and Clemens is pithching. The Red Sox are leading 4-1 and Clemens has just givin up a hit. So, there is a man on first, the batter, and the batter on deck could tie the game with a homer.  If Jeff Russel came in, (The Red Sox reliever), and finished the game without allowing the tieing or losing run to score, he would get the save and Clemens would get the win.                                                                      Thats how I beleive it works.",9,rec.sport.baseball,2023-10-14 18:59:16.722480,yes
"Hi! This is my first time to post on this news group. Now a days , I have stucked at a certain problem. I have '88 mazda mx-6, non  turbo fuel injection.    There is a engine warning signal on the dash board. While driving, this signal turns on, but not always. What does this mean? In the manual, they say ""Go to authorized mazda dealer."". It is really good idea. Don't you think so?    I wanna know how the engine warning signal comes. Is anybody out there who can give me same advice as ""authorized mazda dealer"" can give ?  Youjip Won",7,rec.autos,2023-10-14 18:59:16.722480,yes
" Or do like the manual says and put it in 3rd first, then you can quickly go into reverse... no waiting.  mark",7,rec.autos,2023-10-14 18:59:16.722480,yes
"David Gibbs replies:  I guess I was semi-serious. Without using my hands, I lean and the bike  turns. When leaning, a torque is applied, at a 90deg angle to the front  wheel's axle, just as in countersteering. However, this torque is also about  90deg from the axis of the steering head. Instead of making the  bike lean, gyroscopic effect makes the bars turn, but I don't remember  which way.  -Rick  Oh yeah, I tried this in the driveway, on the centestand,(as suggested  somewhere else) but it doesn't seem to work the same.  ",8,rec.motorcycles,2023-10-14 18:59:16.722480,yes
" When I needed heated grips I made them from pieces of an old bicycle inner tube and a cheap electric heating pad from the drugstore, on top of foam grips: soft *and* warm.  Cheaper by about a factor of 5, too.",8,rec.motorcycles,2023-10-14 18:59:16.722480,yes
" I'm glad Grant Fuhr will never be as over-confident after two wins as you are...it takes four wins to defeat an opponent...each tougher to obtain than the previous one.  Buffalo is off to a good start... Fuhr is proving the Fuhr-bashers wrong, but Boston is an awfully good team.",10,rec.sport.hockey,2023-10-14 18:59:16.722480,yes
" This is a phenomenon known around work as ready-fire-aim. I am astounded at the number of times people post strong opinions about things they not only don't understand but publicly admit to not understanding. In fact, there's a plausible argument that saves are a more rational stat than wins.  For the record, there are two ways that a reliever can get a save: He must finish the game and either 1. have entered the game with the tying run on base, at bat, or on deck. 2. have pitched at least three innings effectively. A pitcher may not get a win and a save in the same game.   But this is an argument that *wins* is a dumb stat, not saves.   This again doesn't support your claim about saves at the beginning of your post.    Mike Jones | AIX High-End Development | mjones@donald.aix.kingston.ibm.com",9,rec.sport.baseball,2023-10-14 18:59:16.722480,yes
"I sent a version of this post out a while ago, but it was swallowed by the void.  My apologies if anyone ends up receiving it.    Oh no, I wasn't confused -- I understood that it was your personal opinion.  But I thought we were discussing the need to shorten games.  The arguments which declare this need seem to hinge on the assertion that long games bore people and otherwise discourage them from going to the ballpark.  I'd like to see if the increased length of games has negatively affected attendance.  If it has, then there *is* a problem, and something should be done about it.  If it hasn't, then there *isn't* a problem, and there's no need to monkey with things as they are.",9,rec.sport.baseball,2023-10-14 18:59:16.722480,yes
"   Or the price tag of the RX7 vs. a Mustang? Part of the definition of a Mustang is that it should be affordable by the masses. Of course Ford knows youre argument, THEY OWN A BIG PIECE OF MAZDA! Take a good look at a Mach III, now an RX7, hhhmmmmm...   That is a tragedy, but I don't think new Camaros or the new Mustangs will.  -Steve",7,rec.autos,2023-10-14 18:59:16.722480,yes
" It's called 'contractual obligations' with Major League Baseball. I would've liked to see the OT of the Isles-Caps game, but I understand where ESPN is coming from. ESPN is committed to a single telecast a night and everything after that is a bonus.",10,rec.sport.hockey,2023-10-14 18:59:16.722480,yes
" Only if he was a ""true motorcyclist with the real riding attitude.""  As you probably are aware, there is a sure-fire rec.moto test for this attribute.   Why?  You think (s)he's worried about road-rash?",8,rec.motorcycles,2023-10-14 18:59:16.722480,yes
" I was at that game, behind home plate next to a scout who was manning the  radar gun.  The 1991 season was winding down and Roger didn't have his  best fastball, topping out at 88-90 (in contrast to Frank Tanana, who went  as low as 50 with one lollipop in the process of striking out Phil  Plantier *five* times on the night).  Inky's shot would have gone further than any I've ever seen if it hadn't crashed *into* the lights (not the  lightstand) as you say over 100 feet high, Roy Hobbs-like, and bounced  back onto the field.  That had to have been a 525-footer if unobstructed, edging out Bo Jackson's drive off Oil Can Boyd to the top of the centerfield bleacher back wall in 1988 for the best I've seen personally  (I was sitting under that one).   --- Glenn Waugaman Digital Equipment Corporation Littleton, MA g_waugaman@nac.enet.dec.com",9,rec.sport.baseball,2023-10-14 18:59:16.722480,yes
Can some on e give me some stats on Forsrg in the World Championships  If sao mail to ua256@freenet.victoria.bc.ca ,10,rec.sport.hockey,2023-10-14 18:59:16.722480,yes
"  Sorry, I still don't buy it.  You're certainly right that the runner is not out merely for running out of the baseline: he must interfere with the play.  But the argument here is over what constitutes interference. You certainly cannot infer from what you've quoted that the batter-runner must be hit by the ball to be guilty of interference: you haven't posted a definition of interference at all.  IMO this calls for one of the ""approved ruling[s]"" that go in small print in the rulebook.  Something like:  APPROVED RULING: If in the judgement of the umpire the runner, by running to the left of the allowed path, caused the fielder to make a bad throw, blocks the vision of the fielder receiving the throw, or otherwise impedes the defensive team's making a play on him, the batter-runner shall be judeged guilty of interference.  or  APPROVED RULING: The runner cannot be judged guilty of interference in the unless he makes contact with a fielder or is hit by the thrown ball.  -- In the absence of such an approved ruling I claim that this is a poor rules trivia question--since it",9,rec.sport.baseball,2023-10-14 18:59:16.722480,yes
"(Susan Clark) asks:  I am not so sure about the celebrated players of the game, but Tod Hartje, who played for Harvard in college and then went on to play in the AHL (initially for Moncton and currently for Providence-- thanks to Daryl  Turner for the update!) appeared on David Letterman's show about two years ago now.  Tod has the distinction of being the first American born player to go  and play in the former Soviet Union. This was arranged by Jets GM Mike  Smith while Tod was playing in Moncton at about the time all those  European players were coming over to North America to play in the NHL.  Tod spent a year playing in Russia and played with or against some of the Russian players who have just entered the NHL in the last two years. He wrote a book on his experiences called ""Behind the Red Line"" (check it out!) and appeared on the Letterman show to talk about them.  -- Mike ",10,rec.sport.hockey,2023-10-14 18:59:16.722480,yes
"         Hey, we could start a new game on the net.  It's called 'Where's Roger?' It's similiar to 'Where's Waldo?' but instead of finding Waldo in a picture of people, we try to find Roger in a newsgroup on the net.  I predict that he'll be in r.s.basketball.pro next.    ",10,rec.sport.hockey,2023-10-14 18:59:16.722480,yes
"  How about,  Frank Jacksonsuck-Bolick or  Frank ""Cake Icing"" Bolick or Frank it's not a cow but a Bolick or Frank How Do you get a ribbon to stay on a birthday present Bolick or Frank ""Burns"" Bolick or Frank Lee Bad Player Bolick or Frank ""I Suck, not"" Bolick  and so on.     Matt Wall * wall@cc.swarthmore.edu * Hey, I gotta job here, OK?",9,rec.sport.baseball,2023-10-14 18:59:16.722480,yes
